{
  "evidence": [
    {
      "created_at": "2026-10-19T00:00:00Z",
      "description": "Synthetic structure fixture for migration and validator tests; not a real product, material or measurement. ",
      "id": "evidence.fixture-v01-synthetic",
      "kind": "assumption",
      "license": "NOASSERTION",
      "reference": "AIPE Magnetics v0.2 synthetic v0.1 fixture (aipe_magnetics/data/fixtures/v01)",
      "review_status": "unreviewed"
    }
  ],
  "evidence_refs": [
    "evidence.fixture-v01-synthetic"
  ],
  "id": "core-material.fixture-v01-synthetic",
  "kind": "core_material",
  "name": "Synthetic v0.1 core material fixture",
  "properties": {
    "description": "Synthetic core-material fixture referencing the synthetic material.",
    "material_ref": "material.fixture-v01-synthetic",
    "relative_permeability": {
      "unit": "1",
      "value": 2000
    }
  },
  "schema_version": "0.1.0",
  "synthetic": true
}
