{
  "evidence": [
    {
      "created_at": "2026-10-19T00:00:00Z",
      "description": "Synthetic structure fixture for migration and validator tests; not a real product, material or measurement. ",
      "id": "evidence.fixture-v01-synthetic",
      "kind": "assumption",
      "license": "NOASSERTION",
      "reference": "AIPE Magnetics v0.2 synthetic v0.1 fixture (aipe_magnetics/data/fixtures/v01)",
      "review_status": "unreviewed"
    }
  ],
  "evidence_refs": [
    "evidence.fixture-v01-synthetic"
  ],
  "id": "operating-condition.fixture-v01-synthetic",
  "kind": "operating_condition",
  "name": "Synthetic v0.1 operating condition fixture",
  "properties": {
    "current_rms": {
      "unit": "A",
      "value": 1.0
    },
    "description": "Illustrative synthetic operating point (100 kHz, 0.1 T, 25 degC, 1 A).",
    "flux_density_peak": {
      "unit": "T",
      "value": 0.1
    },
    "frequency": {
      "unit": "Hz",
      "value": 100000
    },
    "temperature": {
      "unit": "K",
      "value": 298.15
    }
  },
  "schema_version": "0.1.0",
  "synthetic": true
}
