{
  "evidence": [
    {
      "created_at": "2026-10-19T00:00:00Z",
      "description": "Synthetic structure fixture for migration and validator tests; not a real product, material or measurement. ",
      "id": "evidence.fixture-v01-synthetic",
      "kind": "assumption",
      "license": "NOASSERTION",
      "reference": "AIPE Magnetics v0.2 synthetic v0.1 fixture (aipe_magnetics/data/fixtures/v01)",
      "review_status": "unreviewed"
    }
  ],
  "evidence_refs": [
    "evidence.fixture-v01-synthetic"
  ],
  "id": "loss-model.fixture-v01-synthetic",
  "kind": "loss_model",
  "name": "Synthetic v0.1 loss model fixture",
  "properties": {
    "description": "Placeholder artifact path; no fitted parameters exist.",
    "method": "steinmetz",
    "model_artifact": "models/synthetic-placeholder-not-a-real-model.json",
    "operating_condition_refs": [
      "operating-condition.fixture-v01-synthetic"
    ]
  },
  "schema_version": "0.1.0",
  "synthetic": true
}
