{
  "evidence": [
    {
      "created_at": "2026-10-19T00:00:00Z",
      "description": "Synthetic structure fixture for migration and validator tests; not a real product, material or measurement. ",
      "id": "evidence.fixture-v01-synthetic",
      "kind": "assumption",
      "license": "NOASSERTION",
      "reference": "AIPE Magnetics v0.2 synthetic v0.1 fixture (aipe_magnetics/data/fixtures/v01)",
      "review_status": "unreviewed"
    }
  ],
  "evidence_refs": [
    "evidence.fixture-v01-synthetic"
  ],
  "id": "core.fixture-v01-synthetic",
  "kind": "core_geometry",
  "name": "Synthetic v0.1 core geometry fixture",
  "properties": {
    "description": "Illustrative round-number effective parameters (Ae*le = Ve); synthetic.",
    "effective_area": {
      "unit": "m^2",
      "value": 0.0002
    },
    "effective_length": {
      "unit": "m",
      "value": 0.1
    },
    "effective_volume": {
      "unit": "m^3",
      "value": 2e-05
    },
    "family_ref": "family.fixture-v01-synthetic"
  },
  "schema_version": "0.1.0",
  "synthetic": true
}
